{
  "schema_version": "0.1",
  "kind": "governed_action_policy_decision",
  "decision_id": "pd-synthetic-allow-001",
  "policy_input": {
    "proposal_id": "ap-record-event-instance-001",
    "action_type": "record_event_instance",
    "risk_class": "low",
    "requested_by": "SocioProphet/agentplane",
    "evidence_grade": "implementation_safe"
  },
  "decision": {
    "result": "allow",
    "reason": "Low-risk record_event_instance action with confirmed bibliographic evidence."
  },
  "rule_refs": [
    "policy-fabric:governed-action-v0:confirmed-evidence-low-risk"
  ],
  "evidence_refs": [
    {
      "ref": "SocioProphet/sherlock-search#58:valid.confirmed-bibliographic",
      "source_quality": "confirmed_bibliographic",
      "implementation_safe": true
    }
  ],
  "runtime_constraints": [
    {
      "constraint_id": "no-external-side-effects-v0",
      "constraint_type": "no_external_side_effects",
      "description": "The allowed action is limited to recording a bounded internal event instance."
    },
    {
      "constraint_id": "audit-required-v0",
      "constraint_type": "audit_required",
      "description": "Downstream runtime must emit an audit-ready trace."
    }
  ],
  "escalation_requirement": {
    "required": false,
    "reason": "Confirmed evidence and low-risk bounded action."
  },
  "audit_payload": {
    "decision_ref": "pd-synthetic-allow-001",
    "proposal_ref": "ap-record-event-instance-001",
    "result": "allow",
    "evidence_summary": "Confirmed bibliographic evidence supports a low-risk internal record action."
  }
}
